{
  "schema_version": 1,
  "match_id": "series-13-room-7456",
  "game_repo": "https://github.com/Yifeeeeei/EraOfArcaneGame",
  "game_commit": "05be3b6074b2d83e8b1bb83fc3c20c204ad37d5d",
  "protocol_version": 1,
  "completed": true,
  "turns": 7,
  "duration_seconds": null,
  "winner": "player_a",
  "result_reason": "hero_killed",
  "final_life": {"player_a": 5, "player_b": 0},
  "players": {
    "player_a": {"deck_id": "FIRE-BURN-004", "deck_file": "player-a-deck.txt"},
    "player_b": {"deck_id": "WATER-PRESSURE-SCRY-001", "deck_file": "player-b-deck.txt"}
  },
  "key_process": "Physical pressure, controlled burn, and 火焰箭 direct damage ended the game on turn seven.",
  "issues_found": []
}
