{
  "schema_version": 1,
  "match_id": "series-14-room-9544",
  "game_repo": "https://github.com/Yifeeeeei/EraOfArcaneGame",
  "game_commit": "261247af08dd681f738c8ea0ccb2f01cba5abfad",
  "protocol_version": 1,
  "completed": true,
  "turns": 11,
  "duration_seconds": 1248,
  "winner": "player_a",
  "result_reason": "hero_killed",
  "final_life": {
    "player_a": 6,
    "player_b": 0
  },
  "players": {
    "player_a": {
      "deck_id": "FIRE-BURN-004",
      "deck_file": "player-a-deck.txt"
    },
    "player_b": {
      "deck_id": "WATER-PRESSURE-SCRY-001",
      "deck_file": "player-b-deck.txt"
    }
  },
  "key_process": "Fire converted repeated board clears, direct attacks, and Flame Backlash burn into the turn-11 finish.",
  "issues_found": []
}
