{
  "schema_version": 1,
  "match_id": "series-05-room-5138",
  "game_repo": "https://github.com/Yifeeeeei/EraOfArcaneGame",
  "game_commit": "05be3b6074b2d83e8b1bb83fc3c20c204ad37d5d",
  "protocol_version": 1,
  "completed": true,
  "turns": 17,
  "duration_seconds": 3538,
  "winner": "player_a",
  "result_reason": "hero_killed",
  "final_life": {"player_a": 4, "player_b": 0},
  "players": {
    "player_a": {"deck_id": "WIND-RUSH-004", "deck_file": "player-a-deck.txt"},
    "player_b": {"deck_id": "ARCANE-CONTROL-005", "deck_file": "player-b-deck.txt"}
  },
  "key_process": "Extra independent water sources greatly extended defense, but control still lacked a winning clock.",
  "issues_found": []
}
