{
  "schema_version": 1,
  "match_id": "series-10-room-9209",
  "game_repo": "https://github.com/Yifeeeeei/EraOfArcaneGame",
  "game_commit": "05be3b6074b2d83e8b1bb83fc3c20c204ad37d5d",
  "protocol_version": 1,
  "completed": true,
  "turns": 6,
  "duration_seconds": 1920,
  "winner": "player_a",
  "result_reason": "hero_killed",
  "final_life": {"player_a": 4, "player_b": -1},
  "players": {
    "player_a": {"deck_id": "FIRE-BURN-002", "deck_file": "player-a-deck.txt"},
    "player_b": {"deck_id": "WATER-PRESSURE-LIFE-001", "deck_file": "player-b-deck.txt"}
  },
  "key_process": "Fire added independent resources and attackers, then finished with a penetrating fire-meteor scroll.",
  "issues_found": ["https://github.com/Yifeeeeei/EraOfArcaneGame/issues/112"]
}
