{
  "schema_version": 1,
  "match_id": "series-26-room-4685",
  "game_repo": "https://github.com/Yifeeeeei/EraOfArcaneGame",
  "game_commit": "e6908601d0ffd7f538d6eae22d9bd7c18d5c8ecb",
  "protocol_version": 1,
  "completed": true,
  "turns": 10,
  "duration_seconds": 1027,
  "winner": "player_b",
  "result_reason": "hero_killed",
  "final_life": {"player_a": 0, "player_b": 6},
  "players": {
    "player_a": {"deck_id": "EARTH-MOBILE-BEATDOWN-002", "deck_file": "player-a-deck.txt"},
    "player_b": {"deck_id": "WINDLESS-BLOOD-GARDEN-002", "deck_file": "player-b-deck.txt"}
  },
  "key_process": "Shadow converted growth into a real clock: Robert reached one attack after six markers, Spatial Shift recycled the center attack lane, and a rapid Slayer plus Hunter deathrattle finished Jade.",
  "issues_found": []
}
