{
  "schema_version": 1,
  "match_id": "series-08-room-6138",
  "game_repo": "https://github.com/Yifeeeeei/EraOfArcaneGame",
  "game_commit": "05be3b6074b2d83e8b1bb83fc3c20c204ad37d5d",
  "protocol_version": 1,
  "completed": true,
  "turns": 7,
  "duration_seconds": 1606,
  "winner": "player_b",
  "result_reason": "hero_killed",
  "final_life": {"player_a": -1, "player_b": 1},
  "players": {
    "player_a": {"deck_id": "WIND-RUSH-005", "deck_file": "player-a-deck.txt"},
    "player_b": {"deck_id": "ARCANE-CONTROL-006", "deck_file": "player-b-deck.txt"}
  },
  "key_process": "Repeated 幽影寒锋 and a freezing scroll created the final resource gap.",
  "issues_found": []
}
