{
  "schema_version": 1,
  "match_id": "series-20-room-2976",
  "game_repo": "https://github.com/Yifeeeeei/EraOfArcaneGame",
  "game_commit": "261247af08dd681f738c8ea0ccb2f01cba5abfad",
  "protocol_version": 1,
  "completed": true,
  "turns": 10,
  "duration_seconds": 1045,
  "winner": "player_a",
  "result_reason": "hero_killed",
  "final_life": {
    "player_a": 5,
    "player_b": 0
  },
  "players": {
    "player_a": {
      "deck_id": "FIRE-BURN-004",
      "deck_file": "player-a-deck.txt"
    },
    "player_b": {
      "deck_id": "WATER-PRESSURE-SCRY-001",
      "deck_file": "player-b-deck.txt"
    }
  },
  "key_process": "Fire removed both Krakens, exhausted Water defenses with consecutive spells, and finished through a surviving rapid attacker.",
  "issues_found": []
}
