{
  "schema_version": 1,
  "match_id": "series-12-room-1320",
  "game_repo": "https://github.com/Yifeeeeei/EraOfArcaneGame",
  "game_commit": "05be3b6074b2d83e8b1bb83fc3c20c204ad37d5d",
  "protocol_version": 1,
  "completed": true,
  "turns": 10,
  "duration_seconds": null,
  "winner": "player_a",
  "result_reason": "hero_killed",
  "final_life": {"player_a": 6, "player_b": 0},
  "players": {
    "player_a": {"deck_id": "FIRE-BURN-003", "deck_file": "player-a-deck.txt"},
    "player_b": {"deck_id": "WATER-PRESSURE-WOLF-001", "deck_file": "player-b-deck.txt"}
  },
  "key_process": "Partner-paid defenses delayed lethal, but repeated ignite settled the game on turn ten.",
  "issues_found": []
}
