{
  "schema_version": 1,
  "match_id": "series-16-room-2570",
  "game_repo": "https://github.com/Yifeeeeei/EraOfArcaneGame",
  "game_commit": "261247af08dd681f738c8ea0ccb2f01cba5abfad",
  "protocol_version": 1,
  "completed": true,
  "turns": 19,
  "duration_seconds": 1819,
  "winner": "player_b",
  "result_reason": "hero_killed",
  "final_life": {
    "player_a": 0,
    "player_b": 5
  },
  "players": {
    "player_a": {
      "deck_id": "WIND-RUSH-005",
      "deck_file": "player-a-deck.txt"
    },
    "player_b": {
      "deck_id": "FIRE-BURN-004",
      "deck_file": "player-b-deck.txt"
    }
  },
  "key_process": "Wind cleared the Fire board but occupied its own attack slots with resource bodies; Fire rebuilt and won through direct damage and rapid attackers.",
  "issues_found": []
}
