{
  "schema_version": 1,
  "match_id": "series-03-room-7736",
  "game_repo": "https://github.com/Yifeeeeei/EraOfArcaneGame",
  "game_commit": "05be3b6074b2d83e8b1bb83fc3c20c204ad37d5d",
  "protocol_version": 1,
  "completed": true,
  "turns": 4,
  "duration_seconds": null,
  "winner": "player_a",
  "result_reason": "hero_killed",
  "final_life": {"player_a": 6, "player_b": 0},
  "players": {
    "player_a": {"deck_id": "WIND-RUSH-003", "deck_file": "player-a-deck.txt"},
    "player_b": {"deck_id": "ARCANE-CONTROL-003", "deck_file": "player-b-deck.txt"}
  },
  "key_process": "Two spell defenses succeeded, but an empty front row allowed ordinary attacks to kill the hero.",
  "issues_found": []
}
