{
  "schema_version": 1,
  "match_id": "series-22-room-2714",
  "game_repo": "https://github.com/Yifeeeeei/EraOfArcaneGame",
  "game_commit": "e6908601d0ffd7f538d6eae22d9bd7c18d5c8ecb",
  "protocol_version": 1,
  "completed": true,
  "turns": 13,
  "duration_seconds": 2917,
  "winner": "player_a",
  "result_reason": "hero_killed",
  "final_life": {"player_a": 6, "player_b": 0},
  "players": {
    "player_a": {"deck_id": "ROYAL-SURVIVAL-FIRE-001", "deck_file": "player-a-deck.txt"},
    "player_b": {"deck_id": "WIND-RUSH-005", "deck_file": "player-b-deck.txt"}
  },
  "key_process": "Fire survived Wind's spell pressure, used counter traps and Kran filtering to grind the hero to one, then sacrificed a second Fire Arrow for lethal.",
  "issues_found": []
}
